<?xml version='1.0'?>

<!--
 * This code is sample code, provided as-is, and we make no
 * warranties as to its correctness or suitablity for
 * any purpose.
 *
 * We hope that it's useful to you.  Enjoy.
 * Copyright 2004-10 LearningPatterns Inc.
-->

<!-- JavaTunes order XML document (simplified) -->

<order xmlns:xsi='http://www.w3.org/2001/XMLSchema-instance'
       xsi:noNamespaceSchemaLocation='order.xsd'>
  <customer>
    <name>Susan Phillips</name>
    <street>763 Rodeo Circle</street>
    <apt>1A</apt>
    <city>San Francisco</city>
    <state>CA</state>
    <zipcode>94109</zipcode>
    <shipper/>
  </customer>
</order>
